{
  "access_and_adoption": {
    "access_type": "open-weight",
    "downloads": "54,407 downloads (Hub 30-day window, as of 2026-09-06)",
    "likes": "90 likes on the Hub (as of 2026-09-06)"
  },
  "evaluation": {
    "benchmark_scores": [
      {
        "benchmark": "ZH",
        "metric": "Not specified",
        "score": "66.3",
        "setting": "Not specified"
      },
      {
        "benchmark": "ZH",
        "metric": "Not specified",
        "score": "92.7",
        "setting": "Not specified"
      }
    ],
    "human_evals": "Not specified",
    "results_summary": "The developer reports that Qwen2.5-Math-7B-Instruct outperforms the larger Qwen2-Math-Instruct 72B model. With the help of a reward model, the 7B instruct model can solve up to 21 problems, demonstrating strong mathematical problem-solving ability.",
    "safety_evals": "Not specified"
  },
  "identity": {
    "developed_by": "Qwen (Hub organization)",
    "license": "apache-2.0",
    "model_id": "Qwen/Qwen2.5-Math-7B-Instruct",
    "model_type": "Not specified",
    "name": "Qwen2.5-Math-7B-Instruct",
    "release_date": "2024-09-19 (Hugging Face repository creation date)",
    "summary": "Qwen2.5-Math-7B-Instruct is an instruction-tuned model for chat, part of a math-specialized series supporting Chinese and English with advanced mathematical reasoning.",
    "version": "ef9926d75ab1d54532f6a30dd5e760355eb9aa4d"
  },
  "lineage": {
    "base_models": [
      {
        "kind": "finetune",
        "model_id": "Qwen/Qwen2.5-Math-7B",
        "relation": "base_model"
      }
    ],
    "derivatives": "Not specified",
    "model_family": "Qwen2.5 Math"
  },
  "links": {
    "citation": "@article{yang2024qwen25mathtechnicalreportmathematical,\n  title={Qwen2.5-Math Technical Report: Toward Mathematical Expert Model via Self-Improvement}, \n  author={An Yang and Beichen Zhang and Binyuan Hui and Bofei Gao and Bowen Yu and Chengpeng Li and Dayiheng Liu and Jianhong Tu and Jingren Zhou and Junyang Lin and Keming Lu and Mingfeng Xue and Runji Lin and Tianyu Liu and Xingzhang Ren and Zhenru Zhang},\n  journal={arXiv preprint arXiv:2409.12122},\n  year={2024}\n}",
    "code_repository": "https://github.com/QwenLM/Qwen2.5-Math",
    "model_card": "https://huggingface.co/Qwen/Qwen2.5-Math-7B-Instruct",
    "system_card": "Not specified",
    "tech_report": "https://arxiv.org/abs/2409.12122"
  },
  "risks": {
    "possible_risks": [
      {
        "category": "Lack of model transparency",
        "description": "Lack of model transparency is due to insufficient documentation of the model design, development, and evaluation process and the absence of insights into the inner workings of the model.",
        "justification": "The card reports only benchmark-style math problem-solving results and gives no documentation of design, training data, or evaluation process for this checkpoint.",
        "url": "https://www.ibm.com/docs/en/watsonx/saas?topic=SSYOK8/wsj/ai-risk-atlas/lack-of-model-transparency.html"
      },
      {
        "category": "Lack of data transparency",
        "description": "Lack of data transparency might be due to insufficient documentation of training or tuning dataset details, including synthetic data generation. ",
        "justification": "The card summary does not describe the training or fine-tuning datasets used for Qwen2.5-Math-7B-Instruct.",
        "url": "https://www.ibm.com/docs/en/watsonx/saas?topic=SSYOK8/wsj/ai-risk-atlas/lack-of-data-transparency.html"
      },
      {
        "category": "Incomplete usage definition",
        "description": "Since foundation models can be used for many purposes, a model's intended use is important for defining the relevant risks of that model. As the use changes, the relevant risks might correspondingly change.",
        "justification": "The card describes a general math chat/instruct model but does not define intended use cases or limitations, leaving downstream risk assessment underspecified.",
        "url": "https://www.ibm.com/docs/en/watsonx/saas?topic=SSYOK8/wsj/ai-risk-atlas/incomplete-usage-definition.html"
      }
    ]
  },
  "specifications": {
    "architecture_type": "dense decoder-only",
    "context_length": "4,096 tokens (config.json max_position_embeddings)",
    "input_output": [
      "input: text",
      "output: text"
    ],
    "model_size": "14.2 GiB of safetensors weights (15,231,271,888 bytes) in BF16",
    "num_parameters": "7,615,616,512 parameters (safetensors metadata)",
    "precision": "BF16 (safetensors weight dtype)"
  },
  "training_context": {
    "adaptations": "Not specified",
    "data_cutoff": "Not specified",
    "training_data": "Not specified",
    "training_data_size": "Not specified"
  }
}
