{
  "access_and_adoption": {
    "access_type": "open-weight",
    "downloads": "133 downloads (Hub 30-day window, as of 2026-09-07)",
    "likes": "5 likes on the Hub (as of 2026-09-07)"
  },
  "evaluation": {
    "benchmark_scores": "Not specified",
    "human_evals": "Not specified",
    "results_summary": "The developer reports that this model is a supervised instruction-tuning model without RLHF, and that it shows favorable AlpacaEval 2.0 results compared to GPT4-0613, with a score of 31.2 versus 30.4.",
    "safety_evals": "Not specified"
  },
  "identity": {
    "developed_by": "BAAI (Hub organization)",
    "license": "apache-2.0",
    "model_id": "BAAI/Infinity-Instruct-3M-0613-Llama3-70B",
    "model_type": "Not specified",
    "name": "Infinity Instruct",
    "release_date": "2024-06-27 (Hugging Face repository creation date)",
    "summary": "An open-source instruction-tuned model developed by BAAI, trained with supervised fine-tuning rather than RLHF.",
    "version": "9fc53668064bdda22975ca72c5a287f8241c95b3"
  },
  "lineage": {
    "base_models": "Not specified",
    "derivatives": "Not specified",
    "model_family": "Infinity Llama3"
  },
  "links": {
    "citation": "@article{InfinityInstruct2024,\n  title={Infinity Instruct},\n  author={Beijing Academy of Artificial Intelligence (BAAI)},\n  journal={arXiv preprint arXiv:2406.XXXX},\n  year={2024}\n}",
    "code_repository": "Not specified",
    "model_card": "https://huggingface.co/BAAI/Infinity-Instruct-3M-0613-Llama3-70B",
    "system_card": "Not specified",
    "tech_report": "Not specified"
  },
  "risks": {
    "possible_risks": [
      {
        "category": "Hallucination",
        "description": "Hallucinations generate factually inaccurate or untruthful content relative to the model's training data or input. Hallucinations are also sometimes referred to lack of faithfulness or lack of groundedness. In some instances, synthetic data that is generated by large language models might include hallucinations that result in the data possibly being inaccurate, fabricated, or disconnected from reality. Hallucinations can compromise model performance, accuracy, and relevance.",
        "justification": "instruction-tuned chat model with no RLHF and no reported factuality/hallucination evaluation, only AlpacaEval 2.0 style preference score, so hallucination risk is plausibly raised",
        "url": "https://www.ibm.com/docs/en/watsonx/saas?topic=SSYOK8/wsj/ai-risk-atlas/hallucination.html"
      },
      {
        "category": "Impact on the environment",
        "description": "AI, and large generative models in particular, might produce increased carbon emissions and increase water usage for their training and operation.",
        "justification": "70B dense decoder-only model fine-tuned on 3M-scale datasets; training and serving such a large open-weight model plausibly increases carbon/water usage",
        "url": "https://www.ibm.com/docs/en/watsonx/saas?topic=SSYOK8/wsj/ai-risk-atlas/impact-on-the-environment.html"
      },
      {
        "category": "Incorrect risk testing",
        "description": "A metric selected to measure or track a risk is incorrectly selected, incompletely measuring the risk, or measuring the wrong risk for the given context.",
        "justification": "card reports only AlpacaEval 2.0 win-rate as favorable evidence, which measures style/instruction following rather than safety, factuality, or privacy risks",
        "url": "https://www.ibm.com/docs/en/watsonx/saas?topic=SSYOK8/wsj/ai-risk-atlas/incorrect-risk-testing.html"
      }
    ]
  },
  "specifications": {
    "architecture_type": "dense decoder-only",
    "context_length": "8,192 tokens (config.json max_position_embeddings)",
    "input_output": [
      "input: text",
      "output: text"
    ],
    "model_size": "131.4 GiB of safetensors weights (141,107,497,872 bytes) in BF16",
    "num_parameters": "70,553,706,496 parameters (safetensors metadata)",
    "precision": "BF16 (safetensors weight dtype)"
  },
  "training_context": {
    "adaptations": "The model is a fine-tune of Infinity-Instruct-3M-Llama3-70B, trained on Infinity-Instruct-3M and Infinity-Instruct-0613 to produce a stronger chat model.",
    "data_cutoff": "Not specified",
    "training_data": "This checkpoint is a fine-tune of the Infinity-Instruct-3M-Llama3-70B model, further trained on the Infinity-Instruct-3M and Infinity-Instruct-0613 datasets.",
    "training_data_size": "Not specified"
  }
}
