{
  "access_and_adoption": {
    "access_type": "open-weight",
    "downloads": "103 downloads (Hub 30-day window, as of 2026-09-06)",
    "likes": "13 likes on the Hub (as of 2026-09-06)"
  },
  "evaluation": {
    "benchmark_scores": "Not specified",
    "human_evals": "Not specified",
    "results_summary": "Not specified",
    "safety_evals": "Not specified"
  },
  "identity": {
    "developed_by": "HumanLLMs (Hub organization)",
    "license": "apache-2.0",
    "model_id": "HumanLLMs/Humanish-Qwen2.5-7B-Instruct",
    "model_type": "text-generation",
    "name": "Humanish-Qwen2.5-7B-Instruct",
    "release_date": "2024-10-05 (Hugging Face repository creation date)",
    "summary": "A fine-tuned version of Qwen/Qwen2.5-7B-Instruct, optimized to generate more human-like and conversational responses.",
    "version": "7cab6062ab32fa984f51d4bf0254472b2b320362"
  },
  "lineage": {
    "base_models": [
      {
        "kind": "finetune",
        "model_id": "Qwen/Qwen2.5-7B-Instruct",
        "relation": "base_model"
      }
    ],
    "derivatives": "Not specified",
    "model_family": "Humanish Qwen2.5"
  },
  "links": {
    "citation": "@misc{çalık2025enhancinghumanlikeresponseslarge,\n      title={Enhancing Human-Like Responses in Large Language Models}, \n      author={Ethem Yağız Çalık and Talha Rüzgar Akkuş},\n      year={2025},\n      eprint={2501.05032},\n      archivePrefix={arXiv},\n      primaryClass={cs.CL},\n      url={https://arxiv.org/abs/2501.05032}, \n}",
    "code_repository": "Not specified",
    "model_card": "https://huggingface.co/HumanLLMs/Humanish-Qwen2.5-7B-Instruct",
    "system_card": "Not specified",
    "tech_report": "Not specified"
  },
  "risks": {
    "possible_risks": [
      {
        "category": "Lack of data transparency",
        "description": "Lack of data transparency might be due to insufficient documentation of training or tuning dataset details, including synthetic data generation. ",
        "justification": "Card states fine-tuning data only as 10,884 samples spanning 256 topics generated with LLaMA 3 models, with no dataset details or documentation of synthetic generation.",
        "url": "https://www.ibm.com/docs/en/watsonx/saas?topic=SSYOK8/wsj/ai-risk-atlas/lack-of-data-transparency.html"
      },
      {
        "category": "Unrepresentative data",
        "description": "Unrepresentative data occurs when the training or fine-tuning data is not sufficiently representative of the underlying population or does not measure the phenomenon of interest. Synthetic data might not fully capture the complexity and nuances of real-world data. Causes include possible limitations in the seed data quality, biases in generation methods, or inadequate domain knowledge. Thus, AI models might struggle to generalize effectively to real-world scenarios.",
        "justification": "Fine-tuning on only 10,884 synthetic LLaMA 3-generated samples across 256 topics may not capture real-world conversational complexity and can limit generalization.",
        "url": "https://www.ibm.com/docs/en/watsonx/saas?topic=SSYOK8/wsj/ai-risk-atlas/unrepresentative-data.html"
      },
      {
        "category": "Uncertain data provenance",
        "description": "Data provenance refers to the traceability of data (including synthetic data), which includes its ownership, origin, transformations, and generation. Proving that the data is the same as the original source with correct usage terms is difficult without standardized methods for verifying data sources or generation.",
        "justification": "The card does not provide traceability for the synthetic fine-tuning data, including ownership, source, or generation verification.",
        "url": "https://www.ibm.com/docs/en/watsonx/saas?topic=SSYOK8/wsj/ai-risk-atlas/data-provenance.html"
      },
      {
        "category": "Hallucination",
        "description": "Hallucinations generate factually inaccurate or untruthful content relative to the model's training data or input. Hallucinations are also sometimes referred to lack of faithfulness or lack of groundedness. In some instances, synthetic data that is generated by large language models might include hallucinations that result in the data possibly being inaccurate, fabricated, or disconnected from reality. Hallucinations can compromise model performance, accuracy, and relevance.",
        "justification": "Fine-tuning on synthetic LLaMA 3-generated data can propagate or introduce hallucinated content, and the card reports no hallucination evaluation.",
        "url": "https://www.ibm.com/docs/en/watsonx/saas?topic=SSYOK8/wsj/ai-risk-atlas/hallucination.html"
      },
      {
        "category": "Data bias",
        "description": "Historical and societal biases might be present in data that are used to train and fine-tune models. Biases can also be inherited from seed data or exacerbated by synthetic data generation methods.",
        "justification": "Bias may be inherited from the LLaMA 3-generated synthetic fine-tuning data or the base model, and the card reports no bias evaluation.",
        "url": "https://www.ibm.com/docs/en/watsonx/saas?topic=SSYOK8/wsj/ai-risk-atlas/data-bias.html"
      }
    ]
  },
  "specifications": {
    "architecture_type": "dense decoder-only",
    "context_length": "32,768 tokens (config.json max_position_embeddings)",
    "input_output": [
      "input: text",
      "output: text"
    ],
    "model_size": "14.2 GiB of safetensors weights (15,231,271,864 bytes) in BF16",
    "num_parameters": "7,615,616,512 parameters (safetensors metadata)",
    "precision": "BF16 (safetensors weight dtype)"
  },
  "training_context": {
    "adaptations": "The fine-tuning used Low-Rank Adaptation (LoRA) and Direct Preference Optimization (DPO).",
    "data_cutoff": "Not specified",
    "training_data": "The model was fine-tuned on a dataset of 10,884 samples spanning 256 topics, generated with LLaMA 3 models.",
    "training_data_size": "10,884 samples across 256 topics."
  }
}
