{
  "access_and_adoption": {
    "access_type": "open-weight",
    "downloads": "216,152 downloads (Hub 30-day window, as of 2026-09-07)",
    "likes": "360 likes on the Hub (as of 2026-09-07)"
  },
  "evaluation": {
    "benchmark_scores": "Not specified",
    "human_evals": "Not specified",
    "results_summary": "Not specified",
    "safety_evals": "Not specified"
  },
  "identity": {
    "developed_by": "huggyllama (Hub organization)",
    "license": "other",
    "model_id": "huggyllama/llama-7b",
    "model_type": "Not specified",
    "name": "llama-7b",
    "release_date": "2023-04-03 (Hugging Face repository creation date)",
    "summary": "This contains the weights for the LLaMA-7b model.",
    "version": "4782ad278652c7c71b72204d462d6d01eaaf7549"
  },
  "lineage": {
    "base_models": "Not specified",
    "derivatives": "Not specified",
    "model_family": "llama"
  },
  "links": {
    "citation": "Not specified",
    "code_repository": "Not specified",
    "model_card": "https://huggingface.co/huggyllama/llama-7b",
    "system_card": "Not specified",
    "tech_report": "Not specified"
  },
  "risks": {
    "possible_risks": "Not specified"
  },
  "specifications": {
    "architecture_type": "dense decoder-only",
    "context_length": "2,048 tokens (config.json max_position_embeddings)",
    "input_output": [
      "input: text",
      "output: text"
    ],
    "model_size": "12.6 GiB of safetensors weights (13,476,876,661 bytes) in F16",
    "num_parameters": "6,738,417,664 parameters (safetensors metadata)",
    "precision": "F16 (safetensors weight dtype)"
  },
  "training_context": {
    "adaptations": "Not specified",
    "data_cutoff": "Not specified",
    "training_data": "Not specified",
    "training_data_size": "Not specified"
  }
}
