{
  "access_and_adoption": {
    "access_type": "open-weight",
    "downloads": "0 downloads (Hub 30-day window, as of 2026-09-07)",
    "likes": "0 likes on the Hub (as of 2026-09-07)"
  },
  "evaluation": {
    "benchmark_scores": "Not specified",
    "human_evals": "Not specified",
    "results_summary": "Not specified",
    "safety_evals": "Not specified"
  },
  "identity": {
    "developed_by": "Gunulhona (Hub organization)",
    "license": "Not specified",
    "model_id": "Gunulhona/Gemma-Ko-Merge-PEFT",
    "model_type": "Not specified",
    "name": "Gemma-Ko-Merge-PEFT",
    "release_date": "2024-09-30 (Hugging Face repository creation date)",
    "summary": "Not specified",
    "version": "58c9e0bf4c3808c6014a26ac08c2f50cec52bfb3"
  },
  "lineage": {
    "base_models": "Not specified",
    "derivatives": "Not specified",
    "model_family": "Not specified"
  },
  "links": {
    "citation": "Not specified",
    "code_repository": "Not specified",
    "model_card": "https://huggingface.co/Gunulhona/Gemma-Ko-Merge-PEFT",
    "system_card": "Not specified",
    "tech_report": "Not specified"
  },
  "risks": {
    "possible_risks": "Not specified"
  },
  "specifications": {
    "architecture_type": "Not specified",
    "context_length": "Not specified",
    "input_output": "Not specified",
    "model_size": "0.1 GiB of safetensors weights (71,652,344 bytes)",
    "num_parameters": "Not specified",
    "precision": "Not specified"
  },
  "training_context": {
    "adaptations": "Not specified",
    "data_cutoff": "Not specified",
    "training_data": "Not specified",
    "training_data_size": "Not specified"
  }
}
