{
  "access_and_adoption": {
    "access_type": "open-weight",
    "downloads": "374 downloads (Hub 30-day window, as of 2026-09-07)",
    "likes": "158 likes on the Hub (as of 2026-09-07)"
  },
  "evaluation": {
    "benchmark_scores": "Not specified",
    "human_evals": "Not specified",
    "results_summary": "Not specified",
    "safety_evals": "Not specified"
  },
  "identity": {
    "developed_by": "Xkev (Hub organization)",
    "license": "apache-2.0",
    "model_id": "Xkev/Llama-3.2V-11B-cot",
    "model_type": "visual language model",
    "name": "Llama-3.2V-11B-cot",
    "release_date": "2024-11-19 (Hugging Face repository creation date)",
    "summary": "Not specified",
    "version": "e8c2529775b02b818f88e4b400c74653888fdfb9"
  },
  "lineage": {
    "base_models": [
      {
        "kind": "finetune",
        "model_id": "meta-llama/Llama-3.2-11B-Vision-Instruct",
        "relation": "base_model"
      }
    ],
    "derivatives": "Not specified",
    "model_family": "Llama 3.2V cot"
  },
  "links": {
    "citation": "Not specified",
    "code_repository": "https://github.com/PKU-YuanGroup/LLaVA-CoT",
    "model_card": "https://huggingface.co/Xkev/Llama-3.2V-11B-cot",
    "system_card": "Not specified",
    "tech_report": "Not specified"
  },
  "risks": {
    "possible_risks": [
      {
        "category": "Hallucination",
        "description": "Hallucinations generate factually inaccurate or untruthful content relative to the model's training data or input. Hallucinations are also sometimes referred to lack of faithfulness or lack of groundedness. In some instances, synthetic data that is generated by large language models might include hallucinations that result in the data possibly being inaccurate, fabricated, or disconnected from reality. Hallucinations can compromise model performance, accuracy, and relevance.",
        "justification": "Visual language model with open weights and no reported evaluation of factual grounding; image+text input can produce ungrounded text outputs.",
        "url": "https://www.ibm.com/docs/en/watsonx/saas?topic=SSYOK8/wsj/ai-risk-atlas/hallucination.html"
      },
      {
        "category": "Confidential data in prompt",
        "description": "Confidential information might be included as a part of the prompt that is sent to the model.",
        "justification": "Accepts image and text prompts, so users may include confidential information in either modality; card reports no data handling safeguards.",
        "url": "https://www.ibm.com/docs/en/watsonx/saas?topic=SSYOK8/wsj/ai-risk-atlas/confidential-data-in-prompt.html"
      },
      {
        "category": "IP information in prompt",
        "description": "Copyrighted information or other intellectual property might be included as a part of the prompt that is sent to the model.",
        "justification": "Accepts image and text prompts, so copyrighted or IP-protected content may be included in inputs; card reports no filtering or safeguards.",
        "url": "https://www.ibm.com/docs/en/watsonx/saas?topic=SSYOK8/wsj/ai-risk-atlas/ip-information-in-prompt.html"
      },
      {
        "category": "Over- or under-reliance",
        "description": "In AI-assisted decision-making tasks, reliance measures how much a person trusts (and potentially acts on) a model's output. Over-reliance occurs when a person puts too much trust in a model, accepting a model's output when the model's output is likely incorrect. Under-reliance is the opposite, where the person doesn't trust the model but should.",
        "justification": "Open-weight visual language model can produce fluent but unverified outputs, and the card reports no confidence calibration or evaluation to guide appropriate trust.",
        "url": "https://www.ibm.com/docs/en/watsonx/saas?topic=SSYOK8/wsj/ai-risk-atlas/over-or-under-reliance.html"
      }
    ]
  },
  "specifications": {
    "architecture_type": "Not specified",
    "context_length": "Not specified",
    "input_output": [
      "input: image, text",
      "output: text"
    ],
    "model_size": "39.7 GiB of safetensors weights (42,681,001,508 bytes) in F32",
    "num_parameters": "10,670,220,835 parameters (safetensors metadata)",
    "precision": "F32 (safetensors weight dtype)"
  },
  "training_context": {
    "adaptations": "Not specified",
    "data_cutoff": "Not specified",
    "training_data": "Not specified",
    "training_data_size": "Not specified"
  }
}
